version,mineral,stage,year,country,country_rank,share_percent,volume,unit,denominator_type,metric_basis,aggregation_level,material_form,battery_grade_flag,battery_grade_definition,geography_basis,comparison_year_basis,source_name,source_year,source_reference,source_table_or_chart,source_confidence,evidence_tier,missingness_status,extraction_method,calculation_allowed,calculation_block_reason,notes
V2.3,manganese,battery_grade_conversion,2025,China,1,95,,,battery_grade_chemical_production,production,top1,battery_grade_manganese_sulphate,yes,battery-grade manganese sulphate,production_location,source_snapshot_year,IEA Global Critical Minerals Outlook,2025,IEA Global Critical Minerals Outlook 2025 - Beyond NMC batteries: Supply chain issues for emerging battery technologies,Beyond NMC batteries section,high,tier_1,source_reported_only,text_statement,true,,IEA states China currently dominates battery-grade manganese sulphate production with 95 percent of global supply; source supports top-1 only; HHI and top-3 are not available.
V2.3,lithium,battery_grade_conversion,2024,,,,,,qualitative_directional,qualitative,qualitative,unknown,partial,battery-grade lithium chemicals,production_location,source_snapshot_year,IEA,2025,IEA chart: The global midstream and downstream battery supply chain 2024,Chart notes,medium,tier_1,directional_only,text_statement,false,Public chart notes define lithium refining as battery-grade lithium chemicals but the page states chart data is not available for download; no numeric share is entered.,Stage-definition evidence only; do not infer lithium carbonate or hydroxide country shares from this row.
V2.3,natural_graphite,battery_grade_conversion,2024,,,,,,qualitative_directional,qualitative,qualitative,anode_grade_graphite,partial,battery-grade graphite production including battery-grade graphite used in anode supply chains,production_location,source_snapshot_year,IEA,2025,IEA chart: The global midstream and downstream battery supply chain 2024,Chart notes,medium,tier_1,directional_only,text_statement,false,Public chart notes define graphite refining as all battery-grade graphite production but the page states chart data is not available for download; no numeric share is entered.,Stage-definition evidence only; do not infer top-one or top-three graphite shares from qualitative dominance language.
V2.3,cobalt,processing_refining,2024,,,,,,qualitative_directional,qualitative,qualitative,cobalt_sulphate,partial,final refined cobalt products including cobalt sulphate,production_location,source_snapshot_year,IEA,2025,IEA chart: The global midstream and downstream battery supply chain 2024,Chart notes,medium,tier_1,directional_only,text_statement,false,IEA chart notes define cobalt refining as final refined cobalt products including cobalt sulphate but the public page does not provide downloadable numeric chart data or cobalt sulphate country shares.,Stage-definition evidence only; do not classify this row as battery-grade conversion or infer cobalt sulphate top-one or top-three concentration.
V2.3,nickel,processing_refining,2024,,,,,,qualitative_directional,qualitative,qualitative,nickel_sulphate,partial,nickel final products including nickel sulphate,production_location,source_snapshot_year,IEA,2025,IEA chart: The global midstream and downstream battery supply chain 2024,Chart notes,medium,tier_1,directional_only,text_statement,false,IEA chart notes define nickel refining as nickel final products including nickel sulphate but the public page does not provide downloadable numeric chart data or nickel sulphate country shares.,Stage-definition evidence only; do not classify this row as battery-grade conversion or infer nickel sulphate top-one or top-three concentration.
